{
  "$schema": "http://json-schema.org/draft-07/schema#",
  "title": "Trick",
  "description": "A Trick is this system's spell. See MECHANICS.md section 4 for the authoritative spec. Three tiers: Pledge (at-will), Turn (free, limited by a cooldown), Prestige (OP, spends the caster's class engine). There are deliberately NO spell slots and NO upcasting: a Turn's power is tuned by its cooldown, a Prestige's by its engineCost.",
  "type": "object",
  "required": [
    "name",
    "tier",
    "discipline",
    "castingTime",
    "range",
    "components",
    "duration",
    "description"
  ],
  "properties": {
    "id": {
      "type": "string",
      "description": "kebab-case; should match the filename stem."
    },
    "name": {
      "type": "string"
    },
    "source": {
      "type": "string",
      "default": "Circus of Chaos"
    },
    "flavor": {
      "type": "string",
      "description": "One or two lines of in-world colour. Kept out of sheetSummary."
    },
    "tier": {
      "type": "string",
      "enum": [
        "pledge",
        "turn",
        "prestige"
      ],
      "description": "pledge = at-will cantrip equivalent, no cost and no cooldown. turn = the workhorse; always limited by a cooldown, and MAY also spend engine (full casters only, MECHANICS 4.4a). prestige = the showstopper; spends most of the meter, once per combat, minLevel 5+."
    },
    "discipline": {
      "type": "string",
      "enum": [
        "Illusion",
        "Mesmerism",
        "Legerdemain",
        "Pyrotechnics",
        "Animation",
        "Fortune"
      ],
      "description": "Replaces the 8 standard 5e schools (MECHANICS 4.9). Respects the locked damage-type list: Pyrotechnics = fire, Illusion/Mesmerism = psychic."
    },
    "minLevel": {
      "type": "integer",
      "minimum": 1,
      "maximum": 20,
      "default": 1,
      "description": "Earliest character level a class may learn this. Prestiges are 5+."
    },
    "cooldown": {
      "type": "integer",
      "minimum": 1,
      "maximum": 5,
      "description": "TURNS ONLY. Rounds the trick is 'Seen' before it can be cast again: you cannot cast it for this many of your turns. Every Turn has one. For a free Turn it is the sole balance dial - a stronger effect gets a longer cooldown; keep it 1-3. A costed Turn is dialled by its engineCost as well."
    },
    "engineCost": {
      "type": "integer",
      "minimum": 1,
      "description": "How much of the caster's class engine (Phantasm/Mirth/Strings/Clones/Mayhem) this consumes. REQUIRED on a Prestige (price it to eat most of a built-up meter; every Prestige is also capped at once per combat - a tier-wide rule, nothing to set here). OPTIONAL on a Turn, and only for a FULL caster: a costed Turn is the reward for banking the meter, sitting between the free cooldown Turns and the once-per-combat Prestige. Keep a costed Turn well under a Prestige's price. A Pledge may never have one."
    },
    "castingTime": {
      "type": "string",
      "description": "e.g. '1 action', '1 bonus action', '1 reaction'."
    },
    "range": {
      "type": "string"
    },
    "components": {
      "type": "array",
      "description": "Patter (voice, was Verbal) / Flourish (hands, was Somatic) / Prop (an object, was Material). Prop may carry a parenthetical, e.g. 'Prop (a deck of cards)'.",
      "items": {
        "type": "string",
        "pattern": "^(Patter|Flourish|Prop)"
      }
    },
    "duration": {
      "type": "string"
    },
    "concentration": {
      "type": "boolean",
      "description": "True if holding this trick requires concentration (MECHANICS 4.13). Set it whenever `duration` says Concentration. A caster holds ONE concentration trick at a time unless a feature says otherwise, and taking damage forces a concentration check."
    },
    "save": {
      "type": "string",
      "description": "Optional. The saving throw a target makes, e.g. 'Wisdom'. Rendered as a chip."
    },
    "board": {
      "$ref": "#/definitions/board",
      "description": "Optional. What this puts on the map, for the virtual table — an area, a figure that appears, a figure that is moved. See data/schema/board.schema.json. OMIT it for a trick that only targets a creature you can see: that target is already a figure on the board."
    },
    "description": {
      "type": "string",
      "description": "Player-facing prose. Damage dice use the Scaling Die ([[XdY]] / [[XdY+Abil]]); every derived number is a {{Label|formula}} token - both are build-lint enforced."
    },
    "narration": {
      "type": "string",
      "description": "The IN-PLAY tab: how this looks, sounds, and is performed at the table when it happens mid-fight — the swing, the dodge, the wire going taut, what the crowd sees. Pure fiction, ZERO numbers: never restate a die, a DC, a range, a cost, or a condition name here (those live in the mechanics tab). 2-4 sentences. Written second person, present tense."
    },
    "sheetSummary": {
      "type": "string",
      "description": "Condensed mechanics-only text for the future character sheet: effect, damage + type, conditions, cost/uses. No flavor. Not linted."
    },
    "options": {
      "type": "array",
      "description": "For tricks offering a menu or a random table. Rendered as a table by the shared optionTable renderer.",
      "items": {
        "type": "object",
        "required": [
          "name",
          "effect"
        ],
        "properties": {
          "roll": {
            "type": "string"
          },
                "group": { "type": "string", "description": "Optional grouping label. Rows sharing a label render as their own table under that heading, so effects that always apply are never mixed in with a menu you pick from. Omit it and all rows render as one table, as before." },
          "name": {
            "type": "string"
          },
          "effect": {
            "type": "string"
          }
        }
      }
    },
    "classes": {
      "type": "array",
      "description": "Class ids that may learn this trick, e.g. ['illusionist','joker'].",
      "items": {
        "type": "string"
      }
    },
    "subclasses": {
      "type": "array",
      "items": {
        "type": "string"
      },
      "description": "Subclass ids that grant this trick (MECHANICS 4.9d). A trick listed here is NOT on the parent class's general list — only a character of that subclass knows it, and it is granted free on taking the subclass. If set, `classes` must still name the parent class so the trick files under the right ladder."
    }
  },
  "allOf": [
    {
      "if": {
        "properties": {
          "tier": {
            "const": "pledge"
          }
        },
        "required": [
          "tier"
        ]
      },
      "then": {
        "not": {
          "anyOf": [
            {
              "required": [
                "cooldown"
              ]
            },
            {
              "required": [
                "engineCost"
              ]
            }
          ]
        },
        "description": "A Pledge is at-will: it may not carry a cooldown or an engine cost."
      }
    },
    {
      "if": {
        "properties": {
          "tier": {
            "const": "turn"
          }
        },
        "required": [
          "tier"
        ]
      },
      "then": {
        "required": [
          "cooldown"
        ],
        "description": "A Turn is always limited by a cooldown. It MAY also carry an engineCost: a costed Turn is the mid-tier payoff a caster grinds the meter for (MECHANICS 4.4a). Costed Turns are for FULL casters only - a half-caster's engine already pays for its core kit."
      }
    },
    {
      "if": {
        "properties": {
          "tier": {
            "const": "prestige"
          }
        },
        "required": [
          "tier"
        ]
      },
      "then": {
        "required": [
          "engineCost",
          "minLevel"
        ],
        "properties": {
          "minLevel": {
            "minimum": 5
          }
        },
        "not": {
          "required": [
            "cooldown"
          ]
        },
        "description": "A Prestige spends engine, is gated to level 5+, and needs no cooldown - the engine price is its limiter."
      }
    }
  ]
}
