{
  "id": "rigged-draw",
  "name": "Rigged Draw",
  "source": "Circus of Chaos",
  "flavor": "You palm the card it needed and hand back one that guarantees it loses.",
  "tier": "turn",
  "discipline": "Fortune",
  "minLevel": 2,
  "cooldown": 2,
  "engineCost": 1,
  "castingTime": "1 bonus action",
  "range": "30 feet",
  "components": [
    "Patter",
    "Flourish"
  ],
  "duration": "Instantaneous",
  "description": "You gesture at a creature you can see within range, and fate quietly turns against it. Choose one creature within range; the next attack roll or ability check it makes before the start of your next turn is made with disadvantage. This has no effect on saving throws — for those, see your Gambit's Jinx.",
  "narration": "You palm the card it needed and hand back one that guarantees it loses. Nothing visible happens. It simply has a worse next few seconds than it was expecting.",
  "sheetSummary": "Target's next attack roll or ability check before the start of your next turn is made with disadvantage. Does not affect saving throws.",
  "classes": [
    "joker"
  ]
}
