{
  "id": "dead-mans-hand",
  "name": "Dead Man's Hand",
  "source": "Circus of Chaos",
  "flavor": "Aces and eights, face up on the table. Everyone at the game knows what that hand means, and so, now, do you.",
  "tier": "prestige",
  "discipline": "Fortune",
  "minLevel": 5,
  "engineCost": 4,
  "castingTime": "1 action",
  "range": "30 feet",
  "components": [
    "Patter",
    "Flourish",
    "Prop (a deck of cards)"
  ],
  "duration": "Instantaneous",
  "save": "Constitution",
  "description": "You lay down a hand that should not exist — aces and eights, face up, in a fight nobody was playing cards in — and let its meaning land like a verdict. Choose one creature you can see within range. It makes a Constitution saving throw against your {{trick save DC|8 + proficiency bonus + your trick ability modifier}}. On a failure it takes [[6d8]] psychic damage as the certainty of its own death arrives ahead of schedule, and it is stunned until the end of your next turn. On a success it takes half as much damage and is not stunned. Either way it is hurt: this is the biggest thing you do all fight, and it does not hinge on one roll.",
  "narration": "You deal it out onto whatever surface is nearest — a table, a crate, the floor between you — and you do not have to explain it. Everyone at a table knows that hand. So, somehow, does the thing you dealt it to.",
  "sheetSummary": "One creature. Constitution save vs {{trick save DC|8 + proficiency bonus + your trick ability modifier}}. Fail: [[6d8]] psychic and stunned until the end of your next turn. Success: half damage, no stun.",
  "classes": [
    "joker"
  ]
}
