{
  "id": "waking-nightmare",
  "name": "Waking Nightmare",
  "source": "Circus of Chaos",
  "flavor": "You don't show them anything real. You just remind their nerves what pain used to feel like, and let the memory do the rest.",
  "tier": "turn",
  "discipline": "Illusion",
  "minLevel": 3,
  "cooldown": 2,
  "castingTime": "1 action",
  "range": "60 feet",
  "components": [
    "Patter",
    "Prop (a small mirror)"
  ],
  "duration": "Instantaneous",
  "save": "Intelligence",
  "description": "You reach into a creature's mind within range and make it briefly, completely certain that it is being torn apart. The target must make an Intelligence saving throw against your {{trick save DC|8 + proficiency bonus + your trick ability modifier}}, taking [[3d8]] psychic damage on a failure, or half as much damage on a success. A creature immune to being frightened has advantage on this saving throw, since the illusion has nothing to take hold of.",
  "narration": "You do not show them anything real. You simply remind their nerves what being torn apart used to feel like, and let the body take it from there.",
  "sheetSummary": "Action, 60 ft, cooldown 2. Intelligence save vs {{trick save DC|8 + proficiency bonus + your trick ability modifier}}. Fail: [[3d8]] psychic damage. Success: half. Fear-immune creatures have advantage on the save.",
  "classes": [
    "illusionist"
  ]
}
