{
  "id": "smoke-and-mirrors",
  "name": "Smoke and Mirrors",
  "source": "Circus of Chaos",
  "flavor": "The stage fills with fog, mirrors unfold from nowhere, and suddenly nobody - including your enemies - can tell where anyone actually is.",
  "tier": "turn",
  "discipline": "Illusion",
  "minLevel": 2,
  "cooldown": 2,
  "engineCost": 2,
  "castingTime": "1 action",
  "range": "60 feet",
  "components": [
    "Prop (a fistful of flash powder)"
  ],
  "duration": "Concentration, up to 10 minutes",
  "board": {
    "verb": "shape",
    "anchor": "point",
    "range": 60,
    "shape": "cube",
    "size": 20,
    "rounds": 100
  },
  "concentration": true,
  "description": "You fill a 20-foot cube within range with a bank of illusory smoke and drifting false reflections. The area becomes heavily obscured for as long as you concentrate on this trick. The smoke has no substance - it doesn't impede movement and can't be dispersed by wind - and creatures relying on darkvision see only more illusory smoke, not through it. You may designate any number of creatures, including yourself, that see the area normally instead, letting you use the cloud as cover for yourself and your allies while it blinds everyone else. **Costs 2 Phantasm.** A bank of smoke that only your side can see through decides where a fight happens, and this system charges for that: it is the first thing your meter is FOR, and the reason the meter matters from 2nd level rather than from 3rd.",
  "narration": "Fog rolls in and mirrors unfold out of nowhere, and suddenly nobody in the room — including the people you brought — is sure what they are looking at.",
  "sheetSummary": "Fills a 20-ft cube with illusory heavily-obscuring smoke (no wind dispersal, ignores darkvision); you may designate chosen creatures to see through it normally.",
  "classes": [
    "illusionist"
  ]
}
